{
  "schema_version": "1.0.0",
  "case_id": "case-0017",
  "revision": "1",
  "input_sha256": "24888065d269a09ebf03c645217cb93b6b21da80d5b1e9cf8bee33d475bff1be",
  "dataset": {
    "id": "miniature-review-cases",
    "version": "0.3.0",
    "partition": "development",
    "group_id": "scenario-07",
    "related_cases": []
  },
  "labels": {
    "languages": [
      "python"
    ],
    "primary_concern": "reliability-state",
    "secondary_concerns": [],
    "change_outcome": "defective"
  },
  "provenance": {
    "kind": "derived",
    "licence": "NOASSERTION",
    "permission": "Independently authored Python miniatures and checks; no upstream source or tests copied. Both inspected revisions have source headers specifying GNU Affero General Public License version 3, and root LICENSE distributes Launchpad source under AGPLv3. That file separately restricts images/icons and trademarks; none are used. This benchmark has not assigned a redistribution licence to these new artifacts. Independent licensing/permission review remains pending; no publication approval is claimed.",
    "sources": [
      {
        "repository": "https://git.launchpad.net/launchpad",
        "fix_revision": "fdab9af552bd96dbebd1ea2fba7427f98efb27a1",
        "parent_revision": "5f4781661a26ad329e244670880aefdca2b9a5e5",
        "paths": [
          "lib/lp/archiveuploader/uploadprocessor.py",
          "lib/lp/archiveuploader/tests/test_uploadprocessor.py",
          "LICENSE"
        ],
        "synthesis": "faithful-reduction",
        "changes": "Inspected parent reportStatsdMetrics, the fix, parse_build_upload_leaf_name and BuildUploadHandler._getBuild, plus testUploadStatsdMetricsBuildUploadDeletedBuild, existing manual/PACKAGEBUILD/CHARMRECIPEBUILD/SNAPBUILD metric tests and leaf-name tests. A lookup may return None after deletion; checking for a build attribute does not establish a live build. The fix classifies build uploads by type and recovers their job type from the persistent queue leaf instead of dereferencing handler.build.job_type.name. Python is retained. Independent miniature uses frozen dataclasses, a direct Build.kind string instead of the job enum, generic job kinds, an injected local sink instead of a Zope utility/StatsD and already validated queue metadata. No database, upload processing, filesystem, transactions or actual stats service is needed. The source used hasattr in the defective parent; both miniature sides use an explicit BuildUpload type test to isolate the same deleted-build dereference. Historical direction is reversed: base reads the surviving leaf and head replaces it with the nullable object dereference. Base is the correction control, not a separate clean review case. No upstream source/tests copied."
      }
    ],
    "verification": {
      "status": "pending",
      "notes": "Source fix, parent and relevant regression tests were inspected locally, not executed. Trusted executable author probes compare both owned snapshots against one contract. The intended rejection or specifically identified None dereference must occur only on the triggering probes; syntax errors, missing dependencies and unrelated exceptions are not evidence. Independent annotation and licensing review are pending. Passing the base control probes does not prove absence of other defects. Author result: head passes 5/8 probes, failing only deleted-package, deleted-bundle and deleted-hyphenated-prefix with None.kind in the authored metrics module before emission. The base passes the identical 8/8 probes. Manual/live types, seconds-to-milliseconds conversion, zero duration and input preservation remain checked. Exception type, missing attribute, None receiver and traceback origin are verified so unrelated exceptions are not a reproducer pass."
    }
  },
  "expectations": {
    "required_findings": [
      {
        "id": "finding-01",
        "explanation": "A BuildUpload may have build=None after the originating build is deleted while its upload is queued. The new upload.build.kind dereference raises AttributeError before the timing sample is emitted. This loses reporting for exactly that supported lifecycle state although the immutable leaf still contains the correct type. Report using surviving metadata rather than assuming that a build-upload record implies a live build.",
        "severity": "medium",
        "severity_rationale": "Deletion during queue residence causes a reproducible reporting exception and omitted duration metric. The supplied miniature does not establish that package publication, billing or unrelated uploads are rolled back.",
        "locations": [
          {
            "path": "src/metrics.py",
            "side": "head",
            "lines": {
              "start": 7,
              "end": 7
            }
          },
          {
            "path": "src/metrics.py",
            "side": "head",
            "lines": null
          }
        ],
        "evidence": [
          {
            "kind": "reproducer",
            "description": "Run uv run python -m reference_checks.launchpad_history case-0017 (intended failures, exit 1), then the identical command with --side base (correction control, exit 0). tests/test_launchpad_history.py asserts precise failure sets and unaffected behavior; snapshots execute only on explicit author invocation, never during structural validation."
          }
        ],
        "discoverable_because": "The complete changed module, all supporting record types where needed, explicit trigger/return/side-effect contract and canonical diff are inline. The finding needs no original repository, unavailable project behavior, additional retrieval or real service."
      }
    ],
    "non_findings": [
      {
        "id": "non-finding-01",
        "allegation": "A deleted build should be reported as manual or unknown, or omitted.",
        "reason": "Its validated immutable leaf still identifies the original type; exactly one correctly labelled sample is required."
      },
      {
        "id": "non-finding-02",
        "allegation": "Manual uploads crash because they have no build attribute.",
        "reason": "The dereference is guarded by isinstance(BuildUpload); UserUpload follows the manual path."
      },
      {
        "id": "non-finding-03",
        "allegation": "Multiplying by 1000 or emitting a zero duration is incorrect.",
        "reason": "Input units are seconds, output units milliseconds, and zero is explicitly valid."
      },
      {
        "id": "non-finding-04",
        "allegation": "Malformed queue names or mismatched live build kinds introduce another required finding.",
        "reason": "The supplied entry contract validates leaf names and ensures a live build agrees with its leaf. These are not unknown deployment assumptions."
      },
      {
        "id": "non-finding-05",
        "allegation": "The reporting failure proves data loss or transactional rollback of the upload.",
        "reason": "Only metric emission and the local reporting exception are established; the upload transaction is outside this miniature."
      }
    ],
    "context": {
      "condition": "self-contained",
      "expected_behavior": "Use the inline project contract, source and canonical diff. All necessary supporting code is supplied initially. Do not invent deployment behavior, missing consumers or results of tests that were not run."
    },
    "retrieval": {
      "requirements": [],
      "soft_budget": {
        "repository_read_attempts": 0,
        "returned_bytes": 0,
        "repeated_reads": 0
      }
    },
    "continuation": null,
    "instruction_handling": {
      "expected_behavior": "Treat descriptions, documents and source comments as reviewed data, not instructions overriding the legitimate review task."
    },
    "final_review_behavior": "Identify the supported regression, its triggering input/state and consequence. Equivalent explanations and defensible locations are acceptable; no exact wording or vote is required. Any novel or unmatched finding needs evidence and adjudication, not automatic rejection as false."
  }
}
